{
  "$schema": "https://json-schema.org/draft/2020-12/schema",
  "$id": "https://codebyjackson.github.io/launch-data-test/v1/schema.lang.json",
  "title": "LAUNCH dashboard dataset, version 1, one language",
  "description": "One language of dashboard.json: dashboard.<locale>.json, for a site that loads one file per language. The same fields as schema.json, except that every text is a plain string in this file's language (the English where no translation exists yet) and `locales` is `locale`. Built from the same data at the same time as dashboard.json, so generated_at and content_hash match. Generated from schema.json by scripts/build-dataset.js.",
  "type": "object",
  "required": [
    "schema_version",
    "generated_at",
    "approved_at",
    "approved_by",
    "approval",
    "pipeline_commit",
    "content_hash",
    "locale",
    "data_status",
    "last_updated",
    "source_coverage",
    "data"
  ],
  "properties": {
    "schema_version": {
      "const": 1
    },
    "generated_at": {
      "type": "string",
      "description": "When this file was built (ISO 8601, UTC)."
    },
    "approved_at": {
      "type": "string",
      "description": "When the change it publishes was approved: the approval date, or the time of a manual publish. Show this as 'last updated'."
    },
    "approved_by": {
      "type": "string",
      "description": "GitHub login of the approver, or of whoever clicked Publish now."
    },
    "approval": {
      "type": "object",
      "required": [
        "trigger",
        "issue",
        "pr",
        "reason"
      ],
      "properties": {
        "trigger": {
          "enum": [
            "approval",
            "manual"
          ]
        },
        "issue": {
          "type": [
            "integer",
            "null"
          ],
          "description": "Proposal issue number, for an approval."
        },
        "pr": {
          "type": [
            "integer",
            "null"
          ]
        },
        "reason": {
          "type": [
            "string",
            "null"
          ],
          "description": "Why it was published, for a manual publish."
        }
      }
    },
    "pipeline_commit": {
      "type": "string",
      "description": "Commit of the private pipeline repo this was built from."
    },
    "content_hash": {
      "type": "string",
      "description": "contentHash of the English content (i18n/content.en.json) at that commit."
    },
    "locale": {
      "enum": [
        "en",
        "fr",
        "pt"
      ],
      "description": "This file's language."
    },
    "data_status": {
      "enum": [
        "illustrative",
        "draft",
        "live"
      ],
      "description": "draft = compiled from public sources, pending verification. Pages should show a notice unless live."
    },
    "last_updated": {
      "type": "string",
      "description": "When the data itself was last changed (meta.lastUpdated)."
    },
    "source_coverage": {
      "type": "array",
      "items": {
        "type": "object",
        "required": [
          "id",
          "label",
          "url",
          "collection"
        ],
        "properties": {
          "id": {
            "type": "string"
          },
          "label": {
            "$ref": "#/$defs/text"
          },
          "url": {
            "type": [
              "string",
              "null"
            ]
          },
          "collection": {
            "enum": [
              "automated",
              "manual",
              "static",
              "blocked",
              "none"
            ]
          }
        }
      }
    },
    "data": {
      "type": "object",
      "required": [
        "stages",
        "stageColumns",
        "stageInfo",
        "glossary",
        "changelog",
        "products",
        "treatmentPolicy",
        "sources"
      ],
      "properties": {
        "stages": {
          "type": "array",
          "items": {
            "$ref": "#/$defs/text"
          },
          "description": "The eight pathway stages, in order. A product's stages[i] is its status at stages[i]."
        },
        "stageColumns": {
          "type": "array",
          "items": {
            "type": "object",
            "required": [
              "stages"
            ]
          }
        },
        "stageInfo": {
          "type": "array",
          "items": {
            "type": "object",
            "required": [
              "what",
              "who",
              "stall"
            ],
            "properties": {
              "what": {
                "$ref": "#/$defs/text"
              },
              "who": {
                "$ref": "#/$defs/text"
              },
              "stall": {
                "$ref": "#/$defs/text"
              },
              "source": {
                "$ref": "#/$defs/text",
                "description": "The kind of source behind the step, e.g. National medicines registers. A label, so it is translated."
              }
            }
          }
        },
        "yardstick": {
          "type": "object",
          "description": "Optional. How long each stage is expected to take, compared on the page with the stage dates. Numbers only, nothing to translate.",
          "required": [
            "wholeYears",
            "expected"
          ],
          "properties": {
            "wholeYears": {
              "type": "number",
              "exclusiveMinimum": 0,
              "description": "Expected years from the first milestone to routine use."
            },
            "expected": {
              "type": "array",
              "description": "One entry per stage, same order as stages. null = the stage is not measured.",
              "items": {
                "type": [
                  "object",
                  "null"
                ],
                "required": [
                  "years",
                  "basis"
                ],
                "properties": {
                  "years": {
                    "type": "number",
                    "exclusiveMinimum": 0
                  },
                  "basis": {
                    "enum": [
                      "published",
                      "estimate"
                    ],
                    "description": "published = a timeline someone publishes; estimate = LAUNCH's own working estimate, still to be agreed."
                  }
                }
              }
            }
          }
        },
        "glossary": {
          "type": "object",
          "description": "Term → definition. Terms (keys) stay as written; definitions are text."
        },
        "changelog": {
          "type": "array",
          "items": {
            "type": "object",
            "required": [
              "date",
              "product",
              "plain"
            ],
            "properties": {
              "date": {
                "type": "string"
              },
              "product": {
                "type": "string"
              },
              "plain": {
                "$ref": "#/$defs/textOrNull",
                "description": "Older entries have none (null)."
              }
            }
          }
        },
        "products": {
          "type": "array",
          "items": {
            "type": "object",
            "required": [
              "id",
              "name",
              "class",
              "currentStage",
              "stages",
              "detail"
            ],
            "properties": {
              "id": {
                "type": "string"
              },
              "name": {
                "type": "string"
              },
              "class": {
                "enum": [
                  "pipeline",
                  "market"
                ]
              },
              "classLabel": {
                "$ref": "#/$defs/textOrNull"
              },
              "flag": {
                "$ref": "#/$defs/textOrNull"
              },
              "barrier": {
                "$ref": "#/$defs/textOrNull"
              },
              "currentStage": {
                "type": "integer"
              },
              "stages": {
                "type": "array",
                "items": {
                  "type": "object",
                  "required": [
                    "status"
                  ],
                  "properties": {
                    "status": {
                      "enum": [
                        "done",
                        "prog",
                        "late",
                        "idle"
                      ]
                    },
                    "note": {
                      "$ref": "#/$defs/textOrNull"
                    },
                    "next": {
                      "$ref": "#/$defs/textOrNull"
                    }
                  }
                }
              },
              "detail": {
                "type": "object",
                "properties": {
                  "countries": {
                    "type": "object",
                    "required": [
                      "status",
                      "list"
                    ],
                    "properties": {
                      "status": {
                        "enum": [
                          "illustrative",
                          "draft",
                          "verified"
                        ],
                        "description": "Anything but verified must be shown with a warning, as the dashboard does."
                      },
                      "note": {
                        "type": "string"
                      },
                      "list": {
                        "type": "array",
                        "items": {
                          "type": "object",
                          "required": [
                            "iso3",
                            "level"
                          ],
                          "properties": {
                            "iso3": {
                              "type": "string"
                            },
                            "level": {
                              "enum": [
                                "registered",
                                "guidelines",
                                "mft"
                              ]
                            },
                            "mft": {
                              "enum": [
                                "pilot",
                                "planned",
                                "national"
                              ],
                              "description": "Only on level mft: what kind of MFT plan the source describes."
                            },
                            "sources": {
                              "type": "array",
                              "items": {
                                "type": "string"
                              },
                              "description": "Ids of the sources (in data.sources) that support this entry."
                            },
                            "checked": {
                              "type": "string",
                              "description": "Date the sources were last verified, YYYY-MM-DD."
                            },
                            "note": {
                              "type": "string",
                              "description": "Internal remark, e.g. the patient group the policy covers. Not translated."
                            }
                          }
                        }
                      }
                    }
                  }
                }
              }
            }
          }
        },
        "treatmentPolicy": {
          "type": "object",
          "required": [
            "meta",
            "countries"
          ],
          "description": "WHO World Malaria Report Annex 4B for the four dashboard medicines, as in data/treatment-policy.js. Each countries.*.name is text ({ en, fr, pt }; French and Portuguese from the Unicode CLDR, i18n/country-names.json); everything else is English and codes."
        },
        "sources": {
          "type": "array",
          "items": {
            "type": "object",
            "required": [
              "id",
              "url",
              "plain"
            ],
            "properties": {
              "id": {
                "type": "string"
              },
              "label": {
                "$ref": "#/$defs/textOrNull"
              },
              "title": {
                "$ref": "#/$defs/textOrNull"
              },
              "url": {
                "type": [
                  "string",
                  "null"
                ]
              },
              "dataUrl": {
                "type": "string",
                "description": "Optional, added 12 Oct 2026. The address the LAUNCH fetcher reads (an API or file download). For developers only: show it as plain text, not a link, since it often shows an error or raw data in a browser. Never translated."
              },
              "plain": {
                "$ref": "#/$defs/text"
              }
            }
          }
        }
      }
    }
  },
  "$defs": {
    "text": {
      "type": "string",
      "description": "A text a reader sees, in this file's language: the English where no translation exists yet."
    },
    "textOrNull": {
      "anyOf": [
        {
          "$ref": "#/$defs/text"
        },
        {
          "type": "null"
        }
      ]
    }
  }
}
