{
  "schema_version": 1,
  "generated_at": "2026-10-28T16:27:03.257Z",
  "approved_at": "2026-10-28T16:27:03.257Z",
  "approved_by": "codebyjackson",
  "approval": {
    "trigger": "manual",
    "issue": null,
    "pr": null,
    "reason": "Portuguese is now Brazilian (pt-BR), as RBM's site"
  },
  "pipeline_commit": "11681f2c5ed00e0882981964f5a59657610e9504",
  "content_hash": "e200dc0c1ab440f99bcc88210b3eeb8ff445d87a7fec91e5ba46c7c434c54159",
  "locale": "en",
  "data_status": "draft",
  "last_updated": "2026-10-19",
  "source_coverage": [
    {
      "id": "bmjgh-rwanda-mft",
      "label": "BMJ Global Health: Rwanda MFT, 2025",
      "url": "https://pmc.ncbi.nlm.nih.gov/articles/PMC12496036/",
      "collection": "static"
    },
    {
      "id": "cpt-alaq-dose-2025",
      "label": "Clin Pharmacol Ther: ALAQ dosing, 2025",
      "url": "https://pmc.ncbi.nlm.nih.gov/articles/PMC11993281/",
      "collection": "static"
    },
    {
      "id": "clinicaltrials",
      "label": "ClinicalTrials.gov",
      "url": "https://clinicaltrials.gov/",
      "collection": "automated"
    },
    {
      "id": "clinicaltrials-fd-tact",
      "label": "ClinicalTrials.gov: FD-TACT trial",
      "url": "https://clinicaltrials.gov/study/NCT05951595",
      "collection": "static"
    },
    {
      "id": "ctgov-kaluma",
      "label": "ClinicalTrials.gov: KALUMA trial",
      "url": "https://clinicaltrials.gov/study/NCT05842954",
      "collection": "static"
    },
    {
      "id": "ema-eurartesim",
      "label": "EMA: Eurartesim authorisation, 2011",
      "url": "https://www.ema.europa.eu/en/medicines/human/EPAR/eurartesim",
      "collection": "static"
    },
    {
      "id": "ema-pyramax",
      "label": "EMA: Pyramax opinion, 2012",
      "url": "https://www.ema.europa.eu/en/opinion-medicine-use-outside-EU/human/pyramax",
      "collection": "static"
    },
    {
      "id": "ema",
      "label": "European Medicines Agency",
      "url": "https://www.ema.europa.eu/en/medicines/download-medicine-data",
      "collection": "automated"
    },
    {
      "id": "frontiers-ghana-tes",
      "label": "Frontiers: Ghana efficacy study, 2023",
      "url": "https://www.frontiersin.org/journals/public-health/articles/10.3389/fpubh.2025.1715777/full",
      "collection": "static"
    },
    {
      "id": "ghit-alaq-fdc",
      "label": "GHIT Fund: ALAQ Phase III project",
      "url": "https://www.ghitfund.org/investment/portfoliodetail/detail/215/en",
      "collection": "static"
    },
    {
      "id": "global-fund-pqr",
      "label": "Global Fund price and quality reporting",
      "url": "https://insights.theglobalfund.org/t/Public/views/PriceQualityReportingTransactionSummary/TransactionSummary",
      "collection": "manual"
    },
    {
      "id": "malariaj-burkina-mft",
      "label": "Malaria Journal: Burkina Faso MFT, 2022",
      "url": "https://pmc.ncbi.nlm.nih.gov/articles/PMC9235275/",
      "collection": "static"
    },
    {
      "id": "malariaj-kenya-mft",
      "label": "Malaria Journal: Kenya MFT pilot, 2025",
      "url": "https://pmc.ncbi.nlm.nih.gov/articles/PMC12512637/",
      "collection": "static"
    },
    {
      "id": "manufacturer",
      "label": "Manufacturer communications",
      "url": null,
      "collection": "none"
    },
    {
      "id": "mesa-landscape",
      "label": "MESA malaria medicines landscape",
      "url": "https://mesamalaria.org/resource-hub/malaria-medicines-landscape/",
      "collection": "static"
    },
    {
      "id": "mmv-pipeline",
      "label": "MMV pipeline: ganaplacide–lumefantrine",
      "url": "https://www.mmv.org/mmv-pipeline-antimalarial-drugs/ganaplacide-lumefantrine",
      "collection": "static"
    },
    {
      "id": "mmv-dhappq",
      "label": "MMV: Eurartesim (DHA–PPQ) product page",
      "url": "https://www.mmv.org/mmv-pipeline-antimalarial-drugs/dihydroartemisinin-piperaquine",
      "collection": "static"
    },
    {
      "id": "mmv-ganlum-phase3",
      "label": "MMV: GanLum Phase III results, 2025",
      "url": "https://www.mmv.org/newsroom/news-resources-search/phase-3-trial-next-generation-malaria-treatment-ganaplacide-lumefantrine",
      "collection": "static"
    },
    {
      "id": "mmv-pyramax",
      "label": "MMV: Pyramax (ASPY) product page",
      "url": "https://www.mmv.org/mmv-pipeline-antimalarial-drugs/pyronaridine-artesunate",
      "collection": "static"
    },
    {
      "id": "mmv-pyramax-pregnancy",
      "label": "MMV: Pyramax pregnancy label update, 2025",
      "url": "https://www.mmv.org/news-resources-search/pyramaxr-label-update-now-includes-information-treatment-pregnant-women",
      "collection": "static"
    },
    {
      "id": "nafdac",
      "label": "Nigeria: NAFDAC Green Book",
      "url": "https://greenbook.nafdac.gov.ng/",
      "collection": "automated"
    },
    {
      "id": "novartis-kaluma",
      "label": "Novartis: GanLum Phase III results",
      "url": "https://www.novartis.com/news/media-releases/novartis-phase-iii-trial-next-generation-malaria-treatment-klu156-ganlum-meets-primary-endpoint-potential-combat-antimalarial-resistance",
      "collection": "static"
    },
    {
      "id": "plos-aspy-cem",
      "label": "PLOS Medicine: ASPY in routine use",
      "url": "https://journals.plos.org/plosmedicine/article?id=10.1371/journal.pmed.1003669",
      "collection": "static"
    },
    {
      "id": "rwanda-fda",
      "label": "Rwanda: Rwanda FDA register",
      "url": "https://monitoring.rwandafda.gov.rw/register/hmdr/",
      "collection": "automated"
    },
    {
      "id": "tmda",
      "label": "Tanzania: TMDA register",
      "url": "https://imis2.tmda.go.tz/#/public/registered-medicines",
      "collection": "automated"
    },
    {
      "id": "uganda-nda",
      "label": "Uganda: National Drug Register",
      "url": "https://www.nda.or.ug/drug-register/",
      "collection": "blocked"
    },
    {
      "id": "pmi",
      "label": "US President's Malaria Initiative",
      "url": null,
      "collection": "none"
    },
    {
      "id": "dav",
      "label": "Viet Nam: DAV register",
      "url": "https://dichvucong.dav.gov.vn/congbothuoc/index",
      "collection": "automated"
    },
    {
      "id": "whopar-ma140",
      "label": "WHO assessment report: DHA–PPQ (Guilin)",
      "url": "https://extranet.who.int/prequal/sites/default/files/whopar_files/MA140Part7.pdf",
      "collection": "static"
    },
    {
      "id": "whopar-ma093",
      "label": "WHO assessment report: Eurartesim",
      "url": "https://extranet.who.int/prequal/sites/default/files/whopar_files/MA093%20part7v3.pdf",
      "collection": "static"
    },
    {
      "id": "who-eml",
      "label": "WHO Essential Medicines List",
      "url": "https://www.who.int/publications/i/item/WHO-MHP-HPS-EML-2023.02",
      "collection": "manual"
    },
    {
      "id": "who-guidelines",
      "label": "WHO malaria guidelines",
      "url": "https://www.who.int/teams/global-malaria-programme/guidelines-for-malaria",
      "collection": "manual"
    },
    {
      "id": "who-threat-maps",
      "label": "WHO Malaria Threats Map",
      "url": "https://apps.who.int/malaria/maps/threats/",
      "collection": "manual"
    },
    {
      "id": "who-guidelines-2010",
      "label": "WHO malaria treatment guidelines, 2010",
      "url": "https://iris.who.int/handle/10665/44227",
      "collection": "static"
    },
    {
      "id": "who-mft-guide",
      "label": "WHO MFT implementation guide",
      "url": "https://www.who.int/publications/i/item/9789240103603",
      "collection": "static"
    },
    {
      "id": "who-wmr-annex-4b",
      "label": "WHO national drug policy table",
      "url": "https://www.who.int/publications/m/item/annexes-world-malaria-report-2025",
      "collection": "manual"
    },
    {
      "id": "who-pq-comparators",
      "label": "WHO PQ comparator products",
      "url": "https://extranet.who.int/prequal/key-resources/documents/recommended-comparator-products-antimalarial-medicines",
      "collection": "static"
    },
    {
      "id": "who-pq-eoi-malaria-24",
      "label": "WHO PQ: 24th malaria EOI invitation, 2025",
      "url": "https://extranet.who.int/prequal/news/24th-invitation-manufacturers-antimalarial-medicines-submit-expression-interest-eoi-product",
      "collection": "static"
    },
    {
      "id": "who-pq-guidance",
      "label": "WHO prequalification guidance",
      "url": "https://extranet.who.int/prequal/medicines/who-medicines-prequalification-guidance",
      "collection": "static"
    },
    {
      "id": "who-pq-fpp",
      "label": "WHO prequalification list",
      "url": "https://extranet.who.int/prequal/medicines/prequalified/finished-pharmaceutical-products",
      "collection": "automated"
    },
    {
      "id": "who-pado-malaria-2025",
      "label": "WHO: child malaria medicine priorities, 2025",
      "url": "https://www.who.int/publications/i/item/9789240116986",
      "collection": "static"
    },
    {
      "id": "wwarn-iddo",
      "label": "WWARN / IDDO malaria data",
      "url": "https://www.iddo.org/wwarn/access-malaria-data",
      "collection": "manual"
    },
    {
      "id": "zamra",
      "label": "Zambia: ZAMRA register",
      "url": "https://app.zamra.co.zm:42882/portal/#/public/registered-medicines",
      "collection": "automated"
    },
    {
      "id": "mcaz",
      "label": "Zimbabwe: MCAZ register",
      "url": "https://onlineservices.mcaz.co.zw/onlineregister/",
      "collection": "automated"
    }
  ],
  "data": {
    "host": "RBM Partnership to End Malaria",
    "stages": [
      "R&D and Clinical",
      "Stringent Regulatory Approval (SRA)",
      "WHO recommendation",
      "WHO PQ listing",
      "Country registration",
      "National policy adoption",
      "Procurement (public channels)",
      "In-country delivery"
    ],
    "stageColumns": [
      {
        "stages": [
          0
        ]
      },